{
  "schema": "status_packet_v1",
  "component": "ui",
  "canonical_status": "deploy_candidate_started",
  "evidence_links": [
    "/workspace/mediastreamer/journals/system-integration-normalization/ui_gui_stream_v1.md"
  ],
  "blockers": [],
  "recommended_owner_action": "accept",
  "next_owner_click": "approve_pr",
  "decision_scoring": {
    "evidence_quality": 3,
    "rollback_readiness": 3,
    "blast_radius": "low",
    "confidence": 85
  },
  "rollback_action": {
    "enabled": true,
    "command": "git revert <merge_commit_for_ui>",
    "verification": [
      "rerun governance/report checks",
      "confirm owner action contract fields still render"
    ]
  },
  "claim_classes": {
    "governance_docs": "accepted",
    "runtime_validation": "not_claimed",
    "autonomy_eligibility": "not_claimed"
  },
  "timestamp": "2026-04-16T00:00:00+00:00",
  "source_commit": "a4aff91747304e3717a74839406b6fc8ac7f93b3"
}
